"Paper Title","Paper Link","Publication Year","Publication Type","Publication Title","Author Names","DOI","PDF Link","Abstract","TL;DR"
"Automating Multi-Cloud Infrastructure: Leveraging Terraform and IaC for Scalable, Secure, and Efficient Cloud Management","https://scispace.com/paper/automating-multi-cloud-infrastructure-leveraging-terraform-82m50gseyjiy","2025","Journal Article","International journal of scientific research in computer science, engineering and information technology","P. Ravindran","10.32628/cseit25112704","","Cloud computing transformation has revolutionized digital infrastructure management, particularly in multi-cloud environments. The substantial growth in cloud adoption, especially in Infrastructure as a Service, reflects increasing confidence in cloud-based solutions across industries. Implementing Infrastructure as Code principles, robust security frameworks, and automated compliance mechanisms enables organizations to achieve enhanced operational efficiency and reduced deployment times. The effectiveness of cloud-native technologies and automated infrastructure management becomes evident through comprehensive case studies spanning financial institutions and technology startups. The integration of sophisticated deployment models, particularly in the banking and financial services sector, demonstrates the maturity of cloud solutions in handling sensitive operations. The emergence of Terraform as a leading Infrastructure as Code tool, supported by its provider-agnostic architecture and effective state management capabilities, further validates the evolution of infrastructure automation practices. ","This study explores the automation of multi-cloud infrastructure using Terraform and Infrastructure as Code (IaC) to achieve scalable, secure, and efficient cloud management, enhancing operational efficiency and reducing deployment times in various industries, including finance and technology."
"Optimizing DevOps Pipelines with Automation: Ansible and Terraform in AWS Environments","https://scispace.com/paper/optimizing-devops-pipelines-with-automation-ansible-and-32o5hbap2jsu","2024","Journal Article","International journal of scientific research in science, engineering and technology","Venkat Marella","10.32628/ijsrset2410614","","In order to improve operational efficiency and agility in contemporary IT systems, this study investigates the integration of DevOps methods with cloud management. It offers a thorough rundown of the main DevOps tools and technologies needed to manage cloud infrastructure, including as monitoring systems, CI/CD pipelines, Infrastructure as Code (IaC) tools, and configuration management systems. The inability to allow concurrent project development and deployment on the same operational infrastructure (such as a cluster of Docker containers) is a practical shortcoming of current DevOps systems. In order to fill the gaps in the current Development and Operations (DevOps) methods, this paper offers a thorough study and explores how such integrations in Amazon Web Services might enhance deployment efficiency, dependability in software and infrastructure delivery, and security. Thus, the goal of this research is to use the AWS platform to automate the processes of developing and maintaining IT infrastructure. Therefore, we provide a mathematical model in this research to ascertain the ideal arrangement for IT infrastructure. This study investigates in detail how Kubernetes clusters in the AWS environment may be efficiently automated, scaled, and managed using Terraform, an Infrastructure as Code (IaC) tool. It thoroughly examines the advantages of using Terraform, highlighting how it may enhance productivity, automation, scalability, and security while managing Kubernetes clusters. To demonstrate Terraform's capabilities in infrastructure management, the paper contrasts it with other popular (IaC) tools and techniques. It also explores how Terraform works with AWS services to streamline procedures and cut down on complexity. Trends and possible developments in combining Kubernetes and Terraform to improve the administration of cloud-native apps are also covered in the paper. ","This study investigates integrating DevOps with cloud management in AWS, focusing on automation with Ansible and Terraform, to enhance deployment efficiency, reliability, and security, and proposes a mathematical model for optimal IT infrastructure arrangement."
"Infrastructure as Code (IaC): Insights on Various Platforms","https://scispace.com/paper/infrastructure-as-code-iac-insights-on-various-platforms-2eonqds3","2023","Journal Article","Advances in intelligent systems and computing","","10.1007/978-981-19-5443-6_33","","In the present-day tech-stack, cloud computing is evolving as a successful and one of the popular fields of technology where the new businesses are achieving success by deploying their functionalities, products, data, and services on cloud instead of on-premises system and that also without depending on any physical component. Infrastructure as code (IaC) is a set of methodologies which uses code to set up the install packages, virtual machines and networks, and configure environments. A successful IaC implementation and adoption by developers requires a broad set of skills and knowledge. It is DevelopmentOperations’ tactic of provisioning an application’s infrastructure and managing it through binary readable configuration files, instead of any hardware configuration. ","In this paper , Infrastructure as code (IaC) is a set of methodologies which uses code to set up the install packages, virtual machines and networks, and configure environments."
"Decentralizing Infrastructure as Code","https://scispace.com/paper/decentralizing-infrastructure-as-code-2jtei9im","2023","Journal Article","IEEE Software","","10.1109/ms.2022.3192968","","Infrastructure as code (IaC) automates deployments for single teams, falling short of decentralized deployments across groups. We need mature IaC solutions that embrace and consolidate software engineering principles to enable testing and automation advances for decentralized organizations. ","In this paper , the authors propose infrastructure as code (IaC) solutions that embrace and consolidate software engineering principles to enable testing and automation advances for decentralized organizations, and demonstrate the benefits of these solutions."
"DevOps Dynamics: Tools Driving Continuous Integration and Deployment","https://scispace.com/paper/devops-dynamics-tools-driving-continuous-integration-and-2rfvkhom7fuj","2024","Proceedings Article","","Pradeep Gopal Gowda
Norton Stanley S A
Josephine Eskaline Joyce","10.1109/iciteics61368.2024.10624986","","In the ever-evolving landscape of software development, the integration of development and operations (DevOps) practices has become instrumental for achieving agility, collaboration, and rapid delivery. This paper provides an in-depth analysis and review of various DevOps tools that facilitate continuous integration, deployment, and collaboration within software development teams. The study explores the features, strengths, and limitations of prominent tools in the DevOps landscape. This paper delves into the dynamic realm of DevOps, with a specific focus on the tools that steer continuous integration and deployment (CI/CD) processes. Through an extensive examination of key DevOps tools, their functionalities, and real-world applications, this research aims to provide a comprehensive understanding of how these tools contribute to the seamless integration of code changes, automated testing, and continuous delivery. By exploring the nuances of popular DevOps tools, the paper aims to empower software practitioners, teams, and organizations with insights to make informed decisions about tooling choices, fostering a culture of efficiency, reliability, and innovation in the software development lifecycle.","This paper reviews and analyzes various DevOps tools facilitating continuous integration, deployment, and collaboration, exploring their features, strengths, and limitations to provide a comprehensive understanding of their role in seamless code integration and automated delivery."
"Terraform -- Automating Infrastructure as a Service","https://scispace.com/paper/terraform-automating-infrastructure-as-a-service-2koqcrxz","2022","Posted Content","","Andre Lukas","10.48550/arxiv.2205.10676","https://scispace.com/pdf/terraform-automating-infrastructure-as-a-service-2koqcrxz.pdf","Developing a software service requires a strict software development life cycle and process. This process demands controlling all application code through source control management as well as a rigorous versioning and branching strategy. However, the platform and infrastructure also benefit from this rigor. Software services must be deployed to a target run time environment and provisioning that environment through manual user actions is tedious and error-prone. Provisioning manually also becomes prohibitive as the number of resources grow and spread globally over multiple regions. The answer is to apply the same rigor to provisioning the infrastructure as applied to developing the application software. Terraform provides a platform allowing infrastructure resources to be defined in code. This code not only allows the automation of the infrastructure provisioning but also allows for a strict development and review life cycle, same as the application software. ","Terraform as discussed by the authors provides a platform allowing infrastructure resources to be defined in code, which not only allows the automation of the infrastructure provisioning but also allows for a strict development and review life cycle, same as the application software."
"Terraform - Automating Infrastructure as a Service","https://scispace.com/paper/terraform-automating-infrastructure-as-a-service-1qy5091272ky","2024","Journal Article","International journal of science and research","Ponnarasan Krishnan","10.21275/sr24930224444","",": Developing a software service requires a strict software development life cycle and process. This process demands controlling all application code through source control management as well as a rigorous versioning and branching strategy. However, the platform and infrastructure also benefit from this rigor. Software services must be deployed to a target run time environment and provisioning that environment through manual user actions is tedious and error - prone. Provisioning manually also becomes prohibitive as the number of resources grow and spread globally over multiple regions. The answer is to apply the same rigor to provisioning the infrastructure as applied to developing the application software. Terraform provides a platform allowing infrastructure resources to be defined in code. This code not only allows the automation of the infrastructure provisioning but also allows for a strict development and review life cycle, same as the application software.","Terraform automates Infrastructure as a Service provisioning by defining infrastructure resources in code, enabling automation, version control, and review cycles, mirroring software development life cycles to improve efficiency and reduce errors in large-scale, globally distributed environments."
"Automation in Cloud-Based DevOps: A Guide to CI/CD Pipelines and Infrastructure as Code (IaC) with Terraform and Jenkins","https://scispace.com/paper/automation-in-cloud-based-devops-a-guide-to-ci-cd-pipelines-4r9yvv45w1qc","2024","Journal Article","World Journal of Advanced Engineering Technology and Sciences","Taiwo Joseph Akinbolaji
Godwin Nzeako
David Akokodaripon
Akorede Victor Aderoju","10.30574/wjaets.2024.13.2.0542","","This study offers a comprehensive analysis of automation in cloud-based DevOps, focusing on the role of Continuous Integration/Continuous Delivery (CI/CD) pipelines and Infrastructure as Code (IaC) in streamlining software development processes. Employing tools like Jenkins and Terraform, the research aims to demonstrate how automation can significantly enhance operational efficiency, scalability, and security in cloud deployments. Through a detailed examination of CI/CD components and their integration with IaC, this paper identifies key findings, including the reduction of manual errors, improved deployment consistency across environments, and enhanced security through DevSecOps practices. The study further explores challenges such as configuration complexity and compliance, proposing best practices like proactive monitoring, encrypted secrets management, and version control to mitigate these issues. Conclusively, the research recommends the adoption of AI-driven analytics and robust security frameworks to optimize cloud-based CI/CD automation. This work not only highlights current methodologies but also anticipates future trends, providing a strategic roadmap for organizations aiming to leverage DevOps automation effectively. ","This study examines automation in cloud-based DevOps, focusing on CI/CD pipelines and Infrastructure as Code (IaC) with Jenkins and Terraform, to enhance operational efficiency, scalability, and security, while addressing challenges and proposing best practices for effective adoption."
"Enhancing Devops Infrastructure For Efficient Management Of Microservice Applications","https://scispace.com/paper/enhancing-devops-infrastructure-for-efficient-management-of-2w2ey0d4q2","2023","Proceedings Article","","E.M.I.M Ekanayaka
J.K.K.H Thathsarani
D.S Karunanayaka
N. Kuruwitaarachchi
N. Skandakumar","10.1109/icebe59045.2023.00035","","Deploying and managing microservice applications present significant challenges in the software development process. Existing DevOps infrastructures often lack automation and monitoring capabilities, resulting in time-consuming and error-prone deployments. To address these issues, we propose KubFlow, an All-in-One DevOps infrastructure that enhances microservice management. KubFlow integrates leading DevOps technologies such as Jira, GIT, Jenkins, ArgoCD, Terraform, Docker, Kubernetes, Grafana, and Prometheus. Through automation, containerization, and orchestration, KubFlow streamlines the deployment process for faster and more reliable application delivery. It leverages containers to enhance scalability, resource efficiency, and high availability. The architecture includes a Kubernetes cluster deployment using Terraform, an Ingress controller for external access, Jenkins for continuous integration and delivery, ArgoCD for automated deployments, and Prometheus and Grafana for monitoring and visualization. Implemented successfully, KubFlow simplifies microservice deployment and improves monitoring capabilities. By reducing errors, time, and costs associated with complex deployments, KubFlow allows developers to focus on application development while ensuring efficient and reliable software delivery.","KubFlow is an All-in-One DevOps infrastructure that enhances microservice management and simplifies microservice deployment and improves monitoring capabilities and allows developers to focus on application development while ensuring efficient and reliable software delivery."
"Infrastructure as Code als Maßnahme zur Cloud Automatisierung – Hilfestellung zur Auswahl des richtigen Werkzeugs","https://scispace.com/paper/infrastructure-as-code-als-masnahme-zur-cloud-ive8j7vjpw","2020","Journal Article","Praxis Der Wirtschaftsinformatik","Abdullah Özel
Tobias Pautz
Nikolaus Schmidt","10.1365/S40702-020-00657-0","https://scispace.com/pdf/infrastructure-as-code-als-masnahme-zur-cloud-ive8j7vjpw.pdf","Es stehen mittlerweile mehrere IaC-Tools zur Verfugung, um die Bereitstellung und Konfiguration der Cloud-Infrastruktur zu automatisieren. Mit der Fulle an Auswahlmoglichkeiten gestaltet sich der Auswahlprozess fur das geeignete IaC-Tool zunehmend schwieriger. Zusatzlich mangelt es an einer Entscheidungshilfe fur den Auswahlprozess des geeigneten IaC-Tools. Wir glauben, dass eine Entscheidungshilfe fur den Auswahlprozess des IaC-Tools dazu beitragen kann, bei der Cloud Migration von Anwendungen einen besseren Service zu bieten. Daher zielt diese Forschungsarbeit darauf ab, den Auswahlprozess zu unterstutzen, indem eine Hilfestellung bei der Auswahl des richtigen IaC-Tools gegeben wird.","Eine Entscheidungshilfe fur den Auswahlprozess des IaC-Tools dazu beitragen kann, bei der Cloud Migration von Anwendungen einen besseren Service zu bieten, zu unterstutzen."
"Infrastructure as Code (IaC) and Its Role in Achieving DevOps Goals","https://scispace.com/paper/infrastructure-as-code-iac-and-its-role-in-achieving-devops-392vpj7543","2023","Journal Article","International journal of science and research","Dinesh Reddy Chittibala","10.21275/sr24304170702","","In the evolving landscape of software development, DevOps has emerged as a pivotal philosophy, blending software development (Dev) with information technology operations (Ops) to shorten the development lifecycle and provide continuous delivery with high software quality.Central to this paradigm is the concept of Infrastructure as Code (IaC), a practice that programmatically manages and provisions infrastructure through code rather than through manual processes. This paper delves into the integral role of IaC in actualizing DevOps objectives, highlighting how it catalyzes automation, ensures consistency and standardization, facilitates rapid deployment, and enhances collaboration. Through a comprehensive analysis, we explore how IaC not only automates and streamlines operations but also embeds compliance and security into the development process, aligning closely with the DevOps ethos of swift, reliable, and frequent deployments. Additionally, the paper addresses the challenges inherent in implementingIaC within a DevOps framework and proposes best practices to navigate these complexities effectively.The future of software development and IT operations is envisaged as a continuum where IaC and DevOps co -evolve, paving the way for more agile, efficient, and secure IT infrastructure management. ","This paper explores Infrastructure as Code (IaC) as a pivotal component of DevOps, highlighting its role in automating, standardizing, and securing infrastructure management, while addressing challenges and proposing best practices for effective implementation within a DevOps framework."
"Automating CI/CD Pipelines Using Terraform and GitLab: Best Practices for Scalability and Efficiency","https://scispace.com/paper/automating-ci-cd-pipelines-using-terraform-and-gitlab-best-inhohvuculro","2025","Journal Article","Deleted Journal","Naga Murali Krishna Koneru","10.55640/ijefms/volume10issue04-03","","Modern software development uses CI/CD pipelines to speed up software systems' delivery timelines. Most technical teams face pipeline system expansion as a critical engineering hurdle. The paper presents a detailed framework for the automation of CI/CD pipelines, which combines Terraform and GitLab specifically to achieve maximum scalability and efficiency. Organizations can create affordable and secure cloud infrastructure deployment management through a GitLab CI/CD platform integrated with Infrastructure as Code (IaC) frameworks. This allows them to manage infrastructure deployment simultaneously with application deployments while ensuring repeatability. Application and process efficiency and automated infrastructure deployment stem from the connection between IaC technology and GitLab CI/CD tools. The document shows deployment processes by demonstrating actual code, which helps organizations gain competence in tool usage. During the actual implementation of the framework, deployment speed increased by 55%, as the framework reduced infrastructure costs by 25% and improved deployment reliability to 70%. Terraform and GitLab work together to transform DevOps operational frameworks based on the provided results. Implementing such a framework enables organizations to optimize their DevOps workflows, lowering manual tasks while expanding their CI/CD pipeline capabilities. The paper presents essential best practices and integration methods that provide essential knowledge about present-day software development requirements for automated deployments. ","This paper presents a framework for automating CI/CD pipelines using Terraform and GitLab, achieving scalability and efficiency through Infrastructure as Code (IaC) integration, resulting in 55% deployment speed increase, 25% cost reduction, and 70% reliability improvement."
"Automation in Cloud Infrastructure Management: Enhancing Efficiency and Reliability","https://scispace.com/paper/automation-in-cloud-infrastructure-management-enhancing-3u4k0nujd5","2024","Journal Article","Indian Scientific Journal Of Research In Engineering And Management","Varshitha Bysani","10.55041/ijsrem35750","","This paper explores the role of automation in cloud infrastructure management, focusing on its impact on efficiency and reliability. Key use cases, including Infrastructure as Code (IaC) with Terraform, Continuous Integration/ Continuous De- ployment (CI/CD), and real-time monitoring with the ELK stack are examined. The paper discusses how automation reduces manual effort, promotes consistency, and enhances scalability in cloud environments. It highlights the benefits of automated alerting and its role in improving security and system stability. By embracing automation, organizations can streamline cloud infrastructure management, ensuring a robust and adaptable framework that supports business continuity and agility. Index Terms—Cloud Infrastructure Management, Automation, Infrastructure as Code (IaC), Terraform, ELK Stack (Elastic- search, Logstash, Kibana), Automated Alerting ","Automation in cloud infrastructure management enhances efficiency and reliability by reducing manual effort, promoting consistency, and improving scalability. It streamlines processes with IaC, CI/CD, and real-time monitoring tools, ensuring a robust and adaptable framework for business continuity and agility."
"A Conceptual Model for Secure DevOps Architecture Using Jenkins, Terraform, and Kubernetes","https://scispace.com/paper/a-conceptual-model-for-secure-devops-architecture-using-02omcpfe93s8","2023","Journal Article","International Journal of Multidisciplinary Research and Growth Evaluation","Adewale O Adebayo
Afeez A Afuwape
Ayorinde Olayiwola Akindemowo
Eseoghene Daniel Erigha
Ehimah Obuse
Joshua Oluwagbenga Ajayi
Olabode Michael Soneye","10.54660/.ijmrge.2023.4.1.1300-1317","","In the evolving landscape of software development, the integration of security into the DevOps lifecycle—often termed DevSecOps—has become a critical imperative. This paper proposes a conceptual model for a secure DevOps architecture that leverages Jenkins, Terraform, and Kubernetes to ensure continuous integration, continuous delivery, infrastructure as code (IaC), and container orchestration, all underpinned by robust security principles. Jenkins facilitates automated building, testing, and deployment pipelines, while Terraform enables secure infrastructure provisioning through immutable, version-controlled configurations. Kubernetes orchestrates containerized applications, providing dynamic scaling, automated failover, and efficient resource utilization. Together, these tools offer a powerful synergy that can automate development workflows while embedding security measures throughout the software delivery process. The proposed model introduces a security-first approach across the development lifecycle, encompassing code validation, vulnerability scanning, secrets management, policy enforcement, and runtime security. Jenkins pipelines integrate security scanners at multiple stages to detect vulnerabilities early. Terraform configurations are audited for compliance using tools such as Checkov and Terraform Compliance, ensuring secure infrastructure deployment. Kubernetes clusters are fortified with role-based access control (RBAC), network policies, admission controllers, and runtime threat detection solutions like Falco. This conceptual model emphasizes automation, scalability, and proactive threat mitigation, minimizing human error and enabling organizations to achieve secure, rapid software delivery. Additionally, it addresses challenges such as secrets management, with integrations like Vault and Sealed Secrets, and policy enforcement through tools like OPA-Gatekeeper. The model also recommends continuous monitoring and feedback loops to detect anomalies and enforce corrective actions in near real-time. By adopting this secure DevOps architecture, organizations can bridge the gap between agility and security, meeting modern demands for rapid innovation without compromising system integrity. This work contributes to the growing body of DevSecOps knowledge by providing a comprehensive framework that operationalizes security from infrastructure provisioning to application deployment. Future extensions of the model could explore the integration of AI-driven security analytics and self-healing capabilities to further enhance resilience. ","This paper proposes a conceptual model for secure DevOps architecture using Jenkins, Terraform, and Kubernetes, integrating security measures throughout the software delivery process, emphasizing automation, scalability, and proactive threat mitigation for rapid, secure software delivery."
