"Paper Title","Paper Link","Publication Year","Publication Type","Publication Title","Author Names","DOI","PDF Link","Abstract","TL;DR"
"Automating Infrastructure Deployment in DevOps: Evaluating Tools and Strategies for Scalability","https://scispace.com/paper/automating-infrastructure-deployment-in-devops-evaluating-te6bpg2u5doh","2020","Journal Article","International Journal of Leading Research Publication.","Vidyasagar Vangala -","10.70528/ijlrp.v1.i1.1716","","The modern software development timeframe necessitates infrastructure deployment automation because it facilitates DevOps success. This book explores Infrastructure as Code (IaC) as an important tool for structure management because it prevents human mistakes in addition to allowing agile repeatable deployment. The article presents a detailed comparison of four major automation tools like Terraform and AWS CloudFormation and Ansible and Pulumi by discussing their specific features along with their applicable use cases and how to blend them. The discussion includes developed strategies that outline infrastructure automation across diverse environments which combine microservices elements with hybrid cloud infrastructures. The article enriches readers' understanding with practical examples and simple diagrams and side-by-side comparisons showing tried-and-tested techniques of better infrastructure management in DevOps environments. ","This book evaluates tools and strategies for automating infrastructure deployment in DevOps, comparing Terraform, AWS CloudFormation, Ansible, and Pulumi, and presenting practical examples and strategies for scalable infrastructure management across diverse environments."
"Empowering DevOps with Infrastructure as Code :Trends, Tools and Techniques","https://scispace.com/paper/empowering-devops-with-infrastructure-as-code-trends-tools-1dpc33eeo9","2024","Journal Article","Indian Scientific Journal Of Research In Engineering And Management","Sarita Ranjan","10.55041/ijsrem35407","https://scispace.compdf/empowering-devops-with-infrastructure-as-code-trends-tools-1dpc33eeo9.pdf","DevOps has arisen as a pillar of modern software engineering, emphasising the integration of development and operations to ensure effective product delivery. Infrastructure as Code (IaC) is an important DevOps technique that involves defining and managing infrastructure requirements using code, enabling for automated provisioning and maintenance. This technique enhances traceability, reuse, and consistency across development and production environments. The introduction of microservices architectures has increased project teams’ infras- tructure responsibilities, making IaC essential for delivering reliable and efficient deployments. IaC enables developers to describe infrastructure in code, simplifying the deployment process. In both large and small businesses, IaC is essen- tial for supporting efficient DevOps processes.The most recent breakthroughs, tools, and techniques in IaC demonstrate a revolutionary impact on software development and deployment workflows. As more businesses adopt cloud-native designs and containerisation technologies, the requirement for automated infrastructure provisioning grows, leading in the growth of IaC tools and methodologies. Organisations that combine IaC with continuous integration and delivery (CI/CD) pipelines can re- duce time-to-market and improve operational efficiency. IaC not only automates infrastructure management, but it also includes software engineering principles like version control and testing into infrastructure provisioning, which improves consistency and reliability. This democratisation of infrastructure management encourages increased collaboration across cross-functional teams, hence improving accountability and innovation. Implementing IaC is therefore crucial for achieving agility, scalability, and resilience in the digital age. Index Terms—Iac, DevOps, CI/CD, Automation, Cloud-native, Infrastructure Provisioning ,Terraform, Ansible, AWS CloudFor- mation ","IaC empowers DevOps by automating infrastructure provisioning and management, enhancing traceability, reusability, and consistency across development and production environments. It simplifies deployment processes, supports efficient CI/CD pipelines, and promotes collaboration across teams."
"Enhancing Efficiency Through Infrastructure Automation: An In-Depth Analysis of Infrastructure as Code (IaC) Tools","https://scispace.com/paper/enhancing-efficiency-through-infrastructure-automation-an-in-1dvqut8mtx","2023","Proceedings Article","","Milandeep Kour Bali
Ranjan Walia","10.1109/icccis60361.2023.10425162","","Due to the increasing demand for efficient management and provisioning of infrastructure resources, Infrastructure as Code (IaC) tools have become indispensable in modern IT environments. Ensuring the scalability of these tools is crucial for accommodating organizations changing requirements and maintaining their effectiveness. Our investigation delves into the visualization of IaC tool scalability and reliability, illustrated by a line chart. On the x-axis, each tool is depicted, with scalability ratings or metrics plotted on the y-axis. IaC tools can be easily compared and evaluated for scalability with the aid of this chart. It provides valuable insight for organizations looking to make informed decisions about selecting the most appropriate tool based on their specific infrastructure needs and growth potential. The chart summarizes and compares key scalability features, making it easier to identify the best tool for meeting performance expectations.","This investigation delves into the visualization of IaC tool scalability and reliability, illustrated by a line chart, which summarizes and compares key scalability features, making it easier to identify the best tool for meeting performance expectations."
"Scalable GitOps Models for Multi-Cloud Infrastructure as Code Deployment","https://scispace.com/paper/scalable-gitops-models-for-multi-cloud-infrastructure-as-mqyy0svwe2i4","2022","Journal Article","International journal of computing and engineering","Sri Ramya Deevi","10.47941/ijce.3190","","As enterprises embrace multi-cloud strategies to enhance agility, reduce vendor lock-in, and meet regulatory requirements, the need for scalable and reliable infrastructure management becomes critical. GitOps a paradigm that leverages Git as the single source of truth for declarative infrastructure offers a transformative approach to manage Infrastructure as Code (IaC) across heterogeneous cloud environments. This paper explores scalable GitOps models tailored for multi-cloud deployments, highlighting key architectural patterns, toolchains, and workflows that enable secure, auditable, and automated infrastructure operations. The study analyzes the strengths and limitations of leading GitOps tools such as ArgoCD and Flux in coordinating cross-cloud configurations and reconcile loops. The study also examines strategies for repository structuring, modularization of IaC, policy-as-code integration, and dynamic secrets management to support enterprise-scale deployments. The study propose a reference architecture that addresses the challenges of scalability, compliance, and resilience in multi-cloud GitOps workflows. My findings demonstrate that, when correctly implemented, GitOps can serve as a powerful operational model for achieving continuous delivery and governance in complex cloud-native ecosystems. ","This study explores scalable GitOps models for multi-cloud infrastructure as code deployment, analyzing key patterns, toolchains, and workflows for secure, auditable, and automated operations, and proposes a reference architecture addressing scalability, compliance, and resilience challenges."
"Automation Tools for DevOps: Leveraging Ansible, Terraform, and Beyond","https://scispace.com/paper/automation-tools-for-devops-leveraging-ansible-terraform-and-5o38xj5igpd0","2025","Journal Article","International Scientific Journal of Engineering and Management","Surbhi Kanthed","10.55041/isjem01286","","DevOps has rapidly become a cornerstone for modern software development, providing faster release cycles and improved collaboration between development and operations teams. Central to DevOps practices is automation, which addresses the complexity of provisioning and configuring diverse computing environments. This white paper explores state-of-the-art automation tools, with a focus on Ansible for configuration management and Terraform for infrastructure as code (IaC). An extensive review of recent scholarly articles, conference papers, and real-world case studies reveals the unique strengths and limitations of these tools, including Ansible’s agentless architecture and Terraform’s robust declarative approach. In examining multi-cloud and hybrid deployments, the paper identifies best practices in modular code design, version control, automated testing, and policy-as-code for security and compliance. Empirical case studies demonstrate the performance, scalability, and maintainability benefits organizations gain from integrating Ansible and Terraform, while also highlighting challenges related to skill gaps, complex orchestration, and state management. Finally, the paper discusses emerging trends, including AI-driven infrastructure provisioning, serverless computing at the edge, and unified frameworks that incorporate multiple automation tools. By synthesizing these findings, this paper contributes a comprehensive roadmap for adopting and optimizing DevOps automation. It underscores how strategic integration of Ansible, Terraform, and complementary solutions not only reduces operational overhead but also enhances reliability, security, and agility. The outcomes empower practitioners and researchers to address current limitations, seize emerging opportunities, and drive further innovation in the rapidly evolving landscape of DevOps automation. Keywords: DevOps, Automation, Ansible, Terraform, Infrastructure as Code (IaC), Configuration Management, Orchestration, CI/CD, Policy-as-Code, Multi-Cloud, Hybrid Cloud, Security, Compliance, State Management, AI-Driven Automation, Serverless, Observability, GitOps, Modular Design, Monitoring, Scalability. ","This paper reviews state-of-the-art DevOps automation tools, focusing on Ansible and Terraform, and explores their strengths, limitations, and best practices for multi-cloud and hybrid deployments, highlighting performance, scalability, and maintainability benefits."
"Automating Infrastructure Management: Benefits and Challenges of Ansible and Terraform Implementation Across Sectors","https://scispace.com/paper/automating-infrastructure-management-benefits-and-challenges-4h93llhf1f4g","2024","Journal Article","International journal of scientific research in computer science, engineering and information technology","Avinash Pathak","10.32628/cseit241051032","","This article examines the implementation and impact of Infrastructure as Code (IaC) practices using Ansible and Terraform across various industries. Through a mixed-methods approach combining case studies, surveys, and quantitative analysis, we investigate how these tools enable more efficient, scalable, and repeatable infrastructure deployments. Our findings reveal significant benefits, including reduced operational costs (average 30% reduction), improved resource utilization (up to 40% increase), and enhanced disaster recovery capabilities (50% faster recovery times). However, challenges such as skills gaps, security concerns, and legacy system integration persist. The article provides insights into industry-specific applications, highlighting how finance, healthcare, and telecommunications sectors leverage these tools to meet unique demands. We present best practices for successful implementation, emphasizing continuous monitoring, data governance, and cross-functional collaboration. This article contributes to the growing body of literature on IaC and offers practical recommendations for organizations seeking to optimize their infrastructure management strategies in an increasingly digital landscape. ","This study examines the implementation and impact of Ansible and Terraform across industries, revealing significant benefits, including reduced operational costs, improved resource utilization, and enhanced disaster recovery capabilities, but also highlighting challenges and best practices for successful implementation."
"Implementing Infrastructure as Code (IaC) for Scalable DevOps Automation in Hybrid Cloud","https://scispace.com/paper/implementing-infrastructure-as-code-iac-for-scalable-devops-5nzf32htp115","2024","Journal Article","Journal of Sustainable Solutions.","Venkat Marella","10.36676/j.sust.sol.v1.i4.46","https://jss.thewriters.in/index.php/jss/article/download/46/39","The devOps approach known as Infrastructure as Code (IaC) automates all of the infrastructure's requirements to improve deployment speed, security, scalability, and automatic backup and restoration. Writing code that explains the infrastructure—which allows resources to be generated, destroyed, scaled, replaced, and relocated with ease—is the focus of Infrastructure as a Code (IaC). Installing an operating system on it, setting up servers on instance, adjusting how the software in the instances communicates with one other, and much more are all part of the scripting environment process. In order to achieve an effective infrastructure across all sectors while maintaining security via the usage of public and private clouds, this paper examines a number of tools and technology sets. By automating infrastructure deployment and procedures, continually enhancing the integration and delivery process, and monitoring application performance indicators, DevOps dismantles communication silos and enhances teamwork and productivity. In DevOps, automation is essential, and ""Infrastructure as code (IaC)"" is a critical component of automation. The management of infrastructure in cloud and physical datacenter systems will also be covered in this article, along with the impact of agile, DevOps, and IaC on infrastructure management. e. In order to achieve an effective infrastructure across all sectors while maintaining security via the usage of public and private clouds, this paper examines a number of tools and technology sets. Our results indicate that adopting IaC has many advantages, but there may also be some difficulties in putting IaC into practice. Additionally, the research recognizes the contribution of DevOps, cloud systems, and agile to the deployment of Infrastructure as a code. ","This paper explores Infrastructure as Code (IaC) for scalable DevOps automation in hybrid clouds, highlighting its benefits, challenges, and tools, and demonstrating its importance in automating infrastructure deployment, improving integration, and enhancing teamwork and productivity."
"Terraform: Streamlining Infrastructure Deployment and Management Through Infrastructure as Code","https://scispace.com/paper/terraform-streamlining-infrastructure-deployment-and-5d585yxp3k","2023","Proceedings Article","","Abbas Mehdi
Ranjan Walia","10.1109/icccis60361.2023.10425616","","Terraform first appeared in the decade of the 2017 Infrastructure management tools have the potential to revolutionize how we manage IT infrastructure. However, many organizations today report no significant improvements, and some report that using these tools only makes things more complicated. The question of when a person will be able to deploy the infrastructure utilizing the on-go click service arisesas the cloud gives us the click-on-go interface for deploying infrastructure. Using Terraform to deploy the infrastructure with code in a single step is the straightforward answer to the issue. Terraform allows you to write code for numerous resources that will be deployed on your AWS account. Terraform supports a wide range of providers in addition to AWS, including Azure, Digital Ocean, Grafana, etc. Terraform has significantly reduced the time and effort required for deployment, as well as the amount of human interaction required to do it and the associated errors. Before, we had trouble setting up many resources across several cloud providers, but Terraform has made it simple to construct or deploy infrastructure using code, improving our current processand increasing efficiency as we worked on several projects at once.","Before, the authors had trouble setting up many resources across several cloud providers, but Terraform has made it simple to construct or deploy infrastructure using code, improving the current process and increasing efficiency as they worked on several projects at once."
"Infrastructure as Code","https://scispace.com/paper/infrastructure-as-code-2yslo2fk","2023","Journal Article","IEEE Software","Giovanni Quattrocchi
Damian A. Tamburri","10.1109/ms.2022.3212034","","This special issue shows how the realm of infrastructure code has evolved to a status which—analyzed from a scientific perspective—can be considered mature, and rich in practices which can be seen as off-the-shelf approaches to continuous software engineering. ","In this article , the authors show how the realm of infrastructure code has evolved to a status which can be considered mature, and rich in practices that can be seen as off-the-shelf approaches to continuous software engineering."
"Terraform: Infrastructure as Code","https://scispace.com/paper/terraform-infrastructure-as-code-vdc83lufey","2023","Book Chapter","","","10.1007/979-8-8688-0074-0_1","","In this chapter, we embark on a journey through the realm of modern IT and infrastructure as code (IaC). We will discover the tremendous importance of IaC in today’s technology landscape. Terraform, the powerful instrument that is transforming the face of IT infrastructure management, will be the focus of our attention. We will delve into the core aspects that set Terraform apart and make it an industry game-changer. We will begin by exploring the tangible use cases that demonstrate Terraform’s power in orchestrating IT environments with unparalleled agility and efficiency. ","This chapter explores the importance of Infrastructure as Code (IaC) in modern IT, focusing on Terraform, a powerful tool transforming IT infrastructure management, and its core aspects that make it a game-changer in orchestrating IT environments with agility and efficiency."
"Infrastructure as Code: Historical Insights and Future Directions","https://scispace.com/paper/infrastructure-as-code-historical-insights-and-future-1eme1ohpvr2q","2023","Journal Article","International journal of science and research","Vijay Kartik Sikha
Dayakar Siramgari
Satyaveda Somepalli","10.21275/sr24820064820","",": Infrastructure as Code (IaC) revolutionizes IT infrastructure management by automating provisioning and configuration through machine-readable definition files, replacing manual processes. This paper explores the evolution of IaC, highlighting its impact on efficiency, scalability, and security. Key IaC tools like Terraform, AWS CloudFormation, and Azure Resource Manager have transformed infrastructure management by enabling versioned, repeatable, and automated deployments. The integration of AI promises further advancements, including AI-assisted IaC, predictive scaling, and anomaly detection. Additionally, data centers play a crucial role in supporting AI workloads with high-performance computing resources, scalable storage, and efficient networking. As AI becomes more prevalent, energy-efficient data centers will be essential for sustainable AI infrastructure management. Case studies from Netflix, Spotify, and Expedia illustrate successful IaC implementation. The paper concludes by discussing future trends and AI-driven integration in IaC, emphasizing the importance of robust infrastructure for AI workloads.","This paper explores the evolution of Infrastructure as Code (IaC), its impact on efficiency, scalability, and security, and future directions, including AI-assisted IaC, predictive scaling, and anomaly detection, with case studies from Netflix, Spotify, and Expedia."
"Infrastructure as code: A paradigm shifts in cloud resource management and deployment automation","https://scispace.com/paper/infrastructure-as-code-a-paradigm-shifts-in-cloud-resource-j89640w0s6lx","2025","Journal Article","World Journal of Advanced Engineering Technology and Sciences","Ajay Varma Indukuri","10.30574/wjaets.2025.15.1.0478","","This article examines the emergence of Infrastructure as Code (IaC) as a transformative approach to cloud resource management, analyzing its impact on organizational agility and operational consistency. Through a systematic review of contemporary implementation strategies and tooling frameworks, the article explores how IaC principles have fundamentally altered traditional cloud deployment paradigms by enabling programmatic control of infrastructure. The article investigates the symbiotic relationship between IaC methodologies and DevOps practices, highlighting how this convergence facilitates enhanced collaboration between development and operations teams while simultaneously addressing scalability challenges inherent in manual provisioning processes. Drawing upon case studies from diverse industry sectors, the article evaluates both the technical and organizational dimensions of successful IaC adoption, providing insights into implementation patterns, common pitfalls, and emerging best practices. The article suggests that organizations embracing IaC as part of a broader automation strategy experience significant improvements in deployment reliability, security posture, and operational efficiency, while simultaneously reducing the cognitive overhead associated with infrastructure management in complex multi-cloud environments. ","This article examines Infrastructure as Code (IaC) as a transformative approach to cloud resource management, analyzing its impact on organizational agility, operational consistency, and collaboration between development and operations teams."
"Infrastructure as Code: Revolutionizing Cloud Management with Automation Orchestration","https://scispace.com/paper/infrastructure-as-code-revolutionizing-cloud-management-with-1nq024a4r5il","2025","Journal Article","International Scientific Journal of Engineering and Management","Santosh Pashikanti","10.55041/isjem01092","","This white paper presents a detailed analysis of Infrastructure as Code (IaC) principles and practices, focusing on how they revolutionize cloud management through automation orchestration. As enterprises migrate more services to the cloud, the need for consistent, efficient, and scalable deployment practices becomes increasingly important. IaC addresses these needs by automating the provisioning, configuration, and management of infrastructure using machine-readable definitions rather than manual processes. This paper provides an in-depth examination of IaC’s technical architecture, methodologies, implementation strategies, challenges, and solutions. It also includes case studies that illustrate how organizations can leverage IaC to streamline cloud operations, reduce risk, and accelerate innovation. Keywords: Infrastructure as Code, Cloud Management, Automation Orchestration, Configuration Management, DevOps, Continuous Integration/Continuous Deployment (CI/CD) ","This white paper explores Infrastructure as Code (IaC) principles and practices, revolutionizing cloud management through automation orchestration, addressing needs for consistent, efficient, and scalable deployment practices in cloud migration."
"Provider-Agnostic Infrastructure As Code: A Modular Framework For Secure Multi-Tenant Cloud Automation","https://scispace.com/paper/provider-agnostic-infrastructure-as-code-a-modular-framework-epkpvwnrvx5w","2025","Journal Article","Journal of international crisis and risk communication research","Manoj Kumar Reddy Kalakoti","10.63278/jicrcr.vi.3257","https://scispace.compdf/provider-agnostic-infrastructure-as-code-a-modular-framework-epkpvwnrvx5w.pdf","Modern enterprises face significant challenges in managing infrastructure across multiple cloud providers while maintaining security and operational efficiency. This work presents a modular automation framework addressing these challenges through provider-agnostic abstraction patterns implemented using Infrastructure as Code principles. The framework introduces reusable modules for core infrastructure components including networking, identity management, compute, and monitoring systems. A key innovation lies in the abstraction layer enabling unified provisioning across AWS, Azure, and Google Cloud Platform. Security requirements are addressed through integrated Role-Based Access Control, automated secret management, and policy-as-code enforcement. The framework leverages GitOps pipelines for continuous deployment with approval gates and automated rollback capabilities. Evaluation in multi-tenant enterprise environments demonstrates improved deployment consistency, reduced provisioning complexity, and enhanced developer productivity. This work advances Infrastructure as Code by integrating multi-tenancy, security-by-design principles, and provider-agnostic abstractions within a cohesive architecture, significantly reducing operational complexity in multi-cloud deployments. ","This research presents a modular, provider-agnostic framework for secure multi-tenant cloud automation, leveraging Infrastructure as Code principles and GitOps pipelines to improve deployment consistency, reduce complexity, and enhance developer productivity across AWS, Azure, and Google Cloud Platform."
