"Paper Title","Paper Link","Publication Year","Publication Type","Publication Title","Author Names","DOI","PDF Link","Abstract"
"A five-layer framework for AI governance: integrating regulation, standards, and certification","https://scispace.com/paper/http://arxiv.org/abs/2509.11332v1","2025","Preprint","","Avinash Agarwal
Manisha J. Nene","10.1108/TG-03-2025-0065","https://arxiv.org/pdf/2509.11332v1","Purpose: The governance of artificial iintelligence (AI) systems requires a structured approach that connects high-level regulatory principles with practical implementation. Existing frameworks lack clarity on how regulations translate into conformity mechanisms, leading to gaps in compliance and enforcement. This paper addresses this critical gap in AI governance.
  Methodology/Approach: A five-layer AI governance framework is proposed, spanning from broad regulatory mandates to specific standards, assessment methodologies, and certification processes. By narrowing its scope through progressively focused layers, the framework provides a structured pathway to meet technical, regulatory, and ethical requirements. Its applicability is validated through two case studies on AI fairness and AI incident reporting.
  Findings: The case studies demonstrate the framework's ability to identify gaps in legal mandates, standardization, and implementation. It adapts to both global and region-specific AI governance needs, mapping regulatory mandates with practical applications to improve compliance and risk management.
  Practical Implications - By offering a clear and actionable roadmap, this work contributes to global AI governance by equipping policymakers, regulators, and industry stakeholders with a model to enhance compliance and risk management.
  Social Implications: The framework supports the development of policies that build public trust and promote the ethical use of AI for the benefit of society.
  Originality/Value: This study proposes a five-layer AI governance framework that bridges high-level regulatory mandates and implementation guidelines. Validated through case studies on AI fairness and incident reporting, it identifies gaps such as missing standardized assessment procedures and reporting mechanisms, providing a structured foundation for targeted governance measures."
"Defining a new perspective: Enterprise Information Governance","https://scispace.com/paper/http://arxiv.org/abs/2409.14388v1","2024","Preprint","","Alastair McCullough","","https://arxiv.org/pdf/2409.14388v1","This paper adduces a novel definition of regulatory enterprise information governance as a strategic framework that acts through control mechanisms designed to assure accountability in managing decision rights over information and data assets in organizations. This new pragmatic definition takes the perspectives of both the practitioner and of the scholar. It builds upon earlier definitions to take a novel and more clearly regulatory approach and to synthesize a new definition for such governance; to build out a view of it as a scalable regulatory framework for large or complex organizations that sees governance from this new perspective as a business architecture or target operating model in this increasingly critical domain. The paper supports and enables scholarly consideration and further research. It looks at definitions of information and data; of strategy in relation to information and data; of data management; of enterprise architecture; of governance, and governance as a type of strategic endeavor, and of the nature of strategic and tactical policies and standards that form the basis for such governance."
"Automated Environmental Compliance Monitoring with IoT and Open Government Data","https://scispace.com/paper/http://arxiv.org/abs/2010.11945v1","2020","Preprint","","Lizaveta Miasayedava
Keegan McBride
Jeffrey Andrew Tuhtan","","https://arxiv.org/pdf/2010.11945v1","Negative environmental impacts on societies and ecosystems are frequently driven by human activity and amplified by increasing climatic variability. Properly managing these impacts relies on a government's ability to ensure environmental regulatory compliance in the face of increasing uncertainty. Water flow rates are the most widely used evaluation metric for river regulatory compliance. Specifically, compliance thresholds are set by calculating the minimum flow rates required by aquatic species such as fish. These are then designated as the minimum ""environmental flows"" (eflows) for each river. In this paper, we explore how IoT-generated open government data can be used to enhance the development of an automated IoT-based eflows compliance system. To reduce development and operational costs, the proposed solution relies on routinely collected river monitoring data. Our approach allows for any authority with similar data to rapidly develop, test and verify a scalable solution for eflow regulatory compliance monitoring and evaluation. Furthermore, we demonstrate a real-world application of our system using open government data from Estonia's national river monitoring network. The main novelty of this work is that the proposed IoT-based system provides a simple evaluation tool that re-purposes IoT-generated open government data to evaluate compliance and improve monitoring at a national scale. This work showcases a new paradigm of IoT-based solutions using open government data and provides a real-world example of how the solution can automatically evaluate environmental compliance in increasingly uncertain environments."
"Distributed and Decentralised Training: Technical Governance Challenges in a Shifting AI Landscape","https://scispace.com/paper/http://arxiv.org/abs/2507.07765v1","2025","Preprint","","Jakub Kryś
Yashvardhan Sharma
Janet Egan","","https://arxiv.org/pdf/2507.07765v1","Advances in low-communication training algorithms are enabling a shift from centralised model training to compute setups that are either distributed across multiple clusters or decentralised via community-driven contributions. This paper distinguishes these two scenarios - distributed and decentralised training - which are little understood and often conflated in policy discourse. We discuss how they could impact technical AI governance through an increased risk of compute structuring, capability proliferation, and the erosion of detectability and shutdownability. While these trends foreshadow a possible new paradigm that could challenge key assumptions of compute governance, we emphasise that certain policy levers, like export controls, remain relevant. We also acknowledge potential benefits of decentralised AI, including privacy-preserving training runs that could unlock access to more data, and mitigating harmful power concentration. Our goal is to support more precise policymaking around compute, capability proliferation, and decentralised AI development."